{
  "schema_version": 1,
  "contract_id": "ft.rch_worker_storage_approval.v1",
  "generated_at_ms": 1770003600000,
  "approval_id": "approved-candidate",
  "source_bead": "ft-5xwsu.2",
  "evidence_contract_id": "ft.rch_worker_storage_inventory.v1",
  "evidence_artifact_path": "artifacts/rch-worker-pressure/20260518T030000Z/healthy-complete.json",
  "evidence_artifact_sha256": "aaaaaaaaaaaaaaaaaaaaaaaaaaaaaaaaaaaaaaaaaaaaaaaaaaaaaaaaaaaaaaaa",
  "approval_decision": "approved",
  "destructive_recovery_allowed": true,
  "explicit_human_approval_required": true,
  "approval_record": {
    "approver_identity": "operator:jemanuel",
    "approval_reference": "approval://ft-5xwsu.2/approved-candidate",
    "approved_at_ms": 1770000000000,
    "expires_at_ms": 1770007200000,
    "approval_scope": "Move exactly one inactive retained RCH target directory to quarantine on vmi1293453.",
    "approval_text_sha256": "bbbbbbbbbbbbbbbbbbbbbbbbbbbbbbbbbbbbbbbbbbbbbbbbbbbbbbbbbbbbbbbb"
  },
  "requested_path_set_sha256": "cccccccccccccccccccccccccccccccccccccccccccccccccccccccccccccccc",
  "approved_path_set_sha256": "cccccccccccccccccccccccccccccccccccccccccccccccccccccccccccccccc",
  "requested_paths": [
    {
      "path": "/tmp/rch-target/frankenterm/20260518T000000Z",
      "path_sha256": "dddddddddddddddddddddddddddddddddddddddddddddddddddddddddddddddd",
      "requested_operation": "move_to_quarantine",
      "classification": "approved_candidate",
      "live_use_state": "inactive",
      "inventory_evidence_path": "artifacts/rch-worker-pressure/20260518T030000Z/vmi1293453-target-du.json",
      "inventory_evidence_sha256": "eeeeeeeeeeeeeeeeeeeeeeeeeeeeeeeeeeeeeeeeeeeeeeeeeeeeeeeeeeeeeeee",
      "approval_match": "exact",
      "protected_reason": "none",
      "notes": ["Fixture models an exact inactive retained target path with complete evidence."]
    }
  ],
  "allowed_operations": ["move_to_quarantine"],
  "forbidden_operations": [
    "delete_unlisted_path",
    "wildcard_path_expansion",
    "rm_rf_parent",
    "protected_path_cleanup",
    "live_unknown_cleanup",
    "stale_evidence_cleanup",
    "missing_hash_cleanup",
    "expired_approval_cleanup",
    "restart_agent_mail",
    "repair_agent_mail_db",
    "restart_rch_daemon",
    "mutate_worker_mirror",
    "cancel_build",
    "run_local_cargo_as_proof",
    "destructive_git",
    "proceed_without_human_approval"
  ],
  "protected_path_policy": {
    "fail_closed": true,
    "exact_path_match_required": true,
    "hash_required": true,
    "approval_expiration_required": true,
    "live_use_unknown_action": "deny",
    "protected_globs": [
      "/Users/jemanuel/projects/frankenterm/**",
      "/Users/jemanuel/projects/frankenterm/.git/**",
      "/Users/jemanuel/projects/frankenterm/crates/frankenterm-core/**",
      "/var/run/**",
      "/private/tmp/agent-mail/**",
      "/tmp/am-*/**"
    ],
    "allowed_source_evidence": [
      "retained_inventory_artifact",
      "explicit_human_approval",
      "post_action_rch_admission_proof"
    ]
  },
  "expiration": {
    "checked_at_ms": 1770003600000,
    "expires_at_ms": 1770007200000,
    "expired": false,
    "max_age_ms": 7200000
  },
  "rollback_or_restore_notes": [
    "Move the quarantined directory back to the original path if post-action verification fails and the path has not been replaced by a newer build.",
    "Do not remove the quarantine directory without a separate explicit approval."
  ],
  "post_action_verification": {
    "required": true,
    "remote_required_rch": true,
    "commands": [
      "RCH_REQUIRE_REMOTE=1 RCH_NO_SELF_HEALING=1 rch --no-self-healing exec -- env CARGO_BUILD_JOBS=1 CARGO_INCREMENTAL=0 CARGO_TARGET_DIR=<target-dir> cargo test -p frankenterm-core output_gate --lib -- --nocapture"
    ],
    "evidence_required": [
      "rch status --json with worker posture",
      "remote-required selected worker and command",
      "remote execution state and exit status",
      "br dep cycles --json"
    ],
    "beads_to_update": ["ft-5xwsu.3", "ft-4tp7g"]
  },
  "review_notes": ["Positive fixture only; agents still have no authority to perform the recovery."]
}
