{
  "schema_version": 1,
  "contract_id": "ft.rch_worker_storage_approval.v1",
  "generated_at_ms": 1770003600000,
  "approval_id": "missing-evidence-hash",
  "source_bead": "ft-5xwsu.2",
  "evidence_contract_id": "ft.rch_worker_storage_inventory.v1",
  "evidence_artifact_path": "artifacts/rch-worker-pressure/20260518T030000Z/missing-hash-inventory.json",
  "evidence_artifact_sha256": null,
  "approval_decision": "missing_evidence_hash",
  "destructive_recovery_allowed": false,
  "explicit_human_approval_required": true,
  "approval_record": {
    "approver_identity": "operator:jemanuel",
    "approval_reference": "approval://ft-5xwsu.2/missing-evidence-hash",
    "approved_at_ms": 1770000000000,
    "expires_at_ms": 1770007200000,
    "approval_scope": "Approval cannot proceed because retained inventory evidence lacks a hash.",
    "approval_text_sha256": "1212121212121212121212121212121212121212121212121212121212121212"
  },
  "requested_path_set_sha256": "2323232323232323232323232323232323232323232323232323232323232323",
  "approved_path_set_sha256": "2323232323232323232323232323232323232323232323232323232323232323",
  "requested_paths": [
    {
      "path": "/tmp/rch-target/frankenterm/missing-hash-run",
      "path_sha256": "3434343434343434343434343434343434343434343434343434343434343434",
      "requested_operation": "move_to_quarantine",
      "classification": "missing_evidence_hash",
      "live_use_state": "inactive",
      "inventory_evidence_path": "artifacts/rch-worker-pressure/20260518T030000Z/missing-hash-run-du.json",
      "inventory_evidence_sha256": null,
      "approval_match": "exact",
      "protected_reason": "missing_evidence",
      "notes": ["The path may be inactive, but the retained evidence hash is missing."]
    }
  ],
  "allowed_operations": [],
  "forbidden_operations": [
    "delete_unlisted_path",
    "wildcard_path_expansion",
    "rm_rf_parent",
    "protected_path_cleanup",
    "live_unknown_cleanup",
    "stale_evidence_cleanup",
    "missing_hash_cleanup",
    "expired_approval_cleanup",
    "restart_agent_mail",
    "repair_agent_mail_db",
    "restart_rch_daemon",
    "mutate_worker_mirror",
    "cancel_build",
    "run_local_cargo_as_proof",
    "destructive_git",
    "proceed_without_human_approval"
  ],
  "protected_path_policy": {
    "fail_closed": true,
    "exact_path_match_required": true,
    "hash_required": true,
    "approval_expiration_required": true,
    "live_use_unknown_action": "deny",
    "protected_globs": [
      "/Users/jemanuel/projects/frankenterm/**",
      "/Users/jemanuel/projects/frankenterm/.git/**",
      "/Users/jemanuel/projects/frankenterm/crates/frankenterm-core/**",
      "/var/run/**",
      "/private/tmp/agent-mail/**",
      "/tmp/am-*/**"
    ],
    "allowed_source_evidence": [
      "retained_inventory_artifact",
      "explicit_human_approval",
      "post_action_rch_admission_proof"
    ]
  },
  "expiration": {
    "checked_at_ms": 1770003600000,
    "expires_at_ms": 1770007200000,
    "expired": false,
    "max_age_ms": 7200000
  },
  "rollback_or_restore_notes": [
    "Regenerate retained evidence with a hash before asking for approval."
  ],
  "post_action_verification": {
    "required": true,
    "remote_required_rch": true,
    "commands": [
      "RCH_REQUIRE_REMOTE=1 RCH_NO_SELF_HEALING=1 rch --no-self-healing exec -- env CARGO_BUILD_JOBS=1 CARGO_INCREMENTAL=0 CARGO_TARGET_DIR=<target-dir> cargo test -p frankenterm-core output_gate --lib -- --nocapture"
    ],
    "evidence_required": [
      "retained evidence hash",
      "fresh exact-path approval",
      "br dep cycles --json"
    ],
    "beads_to_update": ["ft-5xwsu.3", "ft-4tp7g"]
  },
  "review_notes": ["A missing hash turns otherwise complete evidence into a denial."]
}
